<?xml version="1.0" encoding="UTF-8"?>

<company name="KMK-INVEST" xmlns:xsi="http://www.w3.org/2001/XMLSchema-instance"
         xsi:noNamespaceSchemaLocation="companyforjaxb.xsd">
    <address>
        <city>Minsk</city>
        <street>Nemiga</street>
        <houseNumber>5</houseNumber>
    </address>
    <bankAccount>
        <accountNumber>6896745</accountNumber>
        <dateOfCreate>2011-10-11</dateOfCreate>
    </bankAccount>
    <customers>
        <customer>
            <firstName>Ivan</firstName>
            <lastName>Petrov</lastName>
            <address>
                <city>Minsk</city>
                <street>Kosmonavtov</street>
                <houseNumber>14</houseNumber>
            </address>
            <passport>
                <passportNumber>345678</passportNumber>
                <dateOfIssue>2014-10-14</dateOfIssue>
            </passport>
            <budget>50000</budget>
        </customer>
        <customer>
            <firstName>Mihail</firstName>
            <lastName>Ivanov</lastName>
            <address>
                <city>Minsk</city>
                <street>Esenina</street>
                <houseNumber>30</houseNumber>
            </address>
            <passport>
                <passportNumber>876543</passportNumber>
                <dateOfIssue>2011-12-13</dateOfIssue>
            </passport>
            <budget>200000</budget>
        </customer>
    </customers>
    <employees>
        <employee>
            <firstName>Oleg</firstName>
            <lastName>Sergeev</lastName>
            <address>
                <city>Minsk</city>
                <street>Krasnaya</street>
                <houseNumber>30</houseNumber>
            </address>
            <passport>
                <passportNumber>111543</passportNumber>
                <dateOfIssue>2015-12-13</dateOfIssue>
            </passport>
            <position>Manager</position>
            <salary>1500</salary>
        </employee>
        <employee>
            <firstName>Olga</firstName>
            <lastName>Maksimova</lastName>
            <address>
                <city>Minsk</city>
                <street>Slobodskaya</street>
                <houseNumber>113</houseNumber>
            </address>
            <passport>
                <passportNumber>734543</passportNumber>
                <dateOfIssue>2018-12-01</dateOfIssue>
            </passport>
            <position>Accountant</position>
            <salary>1250</salary>
        </employee>
    </employees>
    <projects>
        <project>
            <title>Green House</title>
            <foundationDate>2020-12-12</foundationDate>
            <price>150000</price>
            <square>105</square>
            <numberOfRooms>5</numberOfRooms>
        </project>
        <project>
            <title>White House</title>
            <foundationDate>2022-01-12</foundationDate>
            <price>300000</price>
            <square>215</square>
            <numberOfRooms>8</numberOfRooms>
        </project>
    </projects>
    <buildingMaterials>
        <buildingMaterial>
            <title>Concrete</title>
            <quantity>200</quantity>
        </buildingMaterial>
        <buildingMaterial>
            <title>Wood</title>
            <quantity>500</quantity>
        </buildingMaterial>
        <buildingMaterial>
            <title>Metal</title>
            <quantity>1000</quantity>
        </buildingMaterial>
    </buildingMaterials>
    <equipments>
        <equipment>
            <title>Crane tower</title>
            <dateOfRelease>2015-11-13</dateOfRelease>
        </equipment>
        <equipment>
            <title>Mixer concrete</title>
            <dateOfRelease>2013-11-12</dateOfRelease>
        </equipment>
        <equipment>
            <title>Generator</title>
            <dateOfRelease>2018-11-13</dateOfRelease>
        </equipment>
    </equipments>
    <vehicles>
        <vehicle>
            <title>Mercedes Benz</title>
            <engine>V8</engine>
            <dateOfRelease>2020-03-10</dateOfRelease>
        </vehicle>
        <vehicle>
            <title>Volkswagen Transporter</title>
            <engine>V3</engine>
            <dateOfRelease>2026-03-15</dateOfRelease>
        </vehicle>
        <vehicle>
            <title>BMW 7</title>
            <engine>V7</engine>
            <dateOfRelease>2021-05-10</dateOfRelease>
        </vehicle>
    </vehicles>
</company>


